{"$schema":"https://json-schema.org/draft/2020-12/schema","additionalProperties":false,"properties":{"aws_journal_sha256":{"pattern":"^[0-9a-f]{64}$","type":"string"},"aws_object_absent":{"const":true},"aws_transaction_owner_sha256":{"pattern":"^[0-9a-f]{64}$","type":"string"},"bundle_b_after_head_sha256":{"pattern":"^[0-9a-f]{64}$","type":"string"},"bundle_b_before_head_sha256":{"pattern":"^[0-9a-f]{64}$","type":"string"},"bundle_b_preserved":{"const":true},"delete_authorization_removed":{"const":true},"lifecycle_converged":{"const":true},"local_action_plan_sha256":{"pattern":"^[0-9a-f]{64}$","type":"string"},"local_journal_sha256":{"pattern":"^[0-9a-f]{64}$","type":"string"},"local_transaction_owner_sha256":{"pattern":"^[0-9a-f]{64}$","type":"string"},"manifest_sha256":{"pattern":"^[0-9a-f]{64}$","type":"string"},"phase":{"const":"retirement-finalizing"},"plan_finalize_sha256":{"pattern":"^[0-9a-f]{64}$","type":"string"},"version":{"const":1}},"required":["aws_journal_sha256","aws_object_absent","aws_transaction_owner_sha256","bundle_b_after_head_sha256","bundle_b_before_head_sha256","bundle_b_preserved","delete_authorization_removed","lifecycle_converged","local_action_plan_sha256","local_journal_sha256","local_transaction_owner_sha256","manifest_sha256","phase","plan_finalize_sha256","version"],"type":"object"}
