{"aws_journal_sha256":"0a57c9758e086262a2d67e0e28e427cefee2e8d24fac7cde4209b6f08bbddbed","aws_object_absent":true,"aws_transaction_owner_sha256":"add1851450ef569dda49780f3a30cb3898fc6c1724f2bc81be3aa14e028c70f4","bundle_b_after_head_sha256":"61c6c000afef1c5ac71d8bf8a51d243bab17990df3bf6da6889e0af71eb89898","bundle_b_before_head_sha256":"61c6c000afef1c5ac71d8bf8a51d243bab17990df3bf6da6889e0af71eb89898","bundle_b_preserved":true,"delete_authorization_removed":true,"lifecycle_converged":true,"local_action_plan_sha256":"fd2efeb1f1515ae7c50a019a343d2e973b4a22b295f43a2a9d118e6c44c42caf","local_journal_sha256":"23fc77cb7be669944ede6b4a634c322f4d5c8dd0d389ed65bf70af851765aa5f","local_transaction_owner_sha256":"def2ab6eff14b33c6e7d725827a3fa6451a3de7d0def760b3158de9c120b3add","manifest_sha256":"8c390d9d14414a40bfa01947089104ad78379436e73f30487032ed1cf7589191","phase":"retirement-finalizing","plan_finalize_sha256":"01fb6db898efbeb77d9ac73fcd579ce90e7b67102b94dd05429fae4fde2d568e","version":1}
